{"dry_run": true, "id": "tc-abcdefgh", "name": "shell", "socket_path": "/tmp/tmux-1000/default", "tmux_version": "3.5", "placement": "default", "matched_rule": null, "session": "termctl", "session_exists": null, "target": "window", "cwd": "/", "argv": [], "env_names": [], "labels": [], "keep_on_exit": "never", "focus": false, "actor": "auto:unknown", "decision_ids": [], "override_escalation": false, "tmux_commands": [["/usr/bin/tmux", "-S", "/tmp/tmux-1000/default", "set", "-s", "--", "exit-unattached", "off", ";", "new-session", "-d", "-P", "-F", "#{pane_id} #{window_id}", "-s", "termctl", "-n", "shell", "-c", "/", ";", "set", "-t", "=termctl:", "--", "destroy-unattached", "off"], ["/usr/bin/tmux", "-S", "/tmp/tmux-1000/default", "if-shell", "-F", "-t", "%NEW", "--", "#{&&:#{==:#{@termctl_pane},},#{==:#{window_id},@NEW}}", "'set' '-p' '-t' '%NEW' '--' '@termctl_v' '1' ; 'set' '-p' '-t' '%NEW' '--' '@termctl_window' '@NEW' ; 'set' '-p' '-t' '%NEW' '--' '@termctl_id' 'tc-abcdefgh' ; 'set' '-p' '-t' '%NEW' '--' '@termctl_name' 'shell' ; 'set' '-p' '-t' '%NEW' '--' '@termctl_marker' '' ; 'set' '-p' '-t' '%NEW' '--' '@termctl_marker_text' '' ; 'set' '-p' '-t' '%NEW' '--' '@termctl_labels' '' ; 'set' '-p' '-t' '%NEW' '--' '@termctl_placement' 'default' ; 'set' '-p' '-t' '%NEW' '--' '@termctl_keep' 'never' ; 'set' '-p' '-t' '%NEW' '--' '@termctl_created' '2026-01-01T00:00:00.000Z' ; 'set' '-p' '-t' '%NEW' '--' '@termctl_pid' '' ; 'set' '-p' '-t' '%NEW' '--' '@termctl_pid_start' '' ; 'set' '-p' '-t' '%NEW' '--' '@termctl_pane' '%NEW' ; 'set' '-w' '-t' '%NEW' '--' 'automatic-rename' 'off' ; 'set' '-w' '-t' '%NEW' '--' 'allow-rename' 'off' ; 'set' '-p' '-t' '%NEW' '--' 'remain-on-exit' 'off' ; 'display' '-p' '-t' '%NEW' '--' '#{pane_pid} #{pane_dead} #{pid}' ; 'display' '-p' '-t' '%NEW' '--' 'termctl-tagged'", "'display' '-p' '--' 'termctl-nomatch'"]]}
