{"dry_run": true, "id": "tc-abcdefgh", "name": "true", "socket_path": "/tmp/tmux-1000/default", "tmux_version": "3.5", "placement": "default", "matched_rule": null, "session": "termctl", "session_exists": true, "target": "window", "cwd": "/", "argv": ["true"], "env_names": ["TOKEN"], "labels": ["kind=review"], "keep_on_exit": "never", "focus": false, "actor": "auto:unknown", "decision_ids": ["d-7"], "override_escalation": false, "tmux_commands": [["/usr/bin/tmux", "-S", "/tmp/tmux-1000/default", "new-window", "-d", "-P", "-F", "#{pane_id} #{window_id}", "-t", "=termctl:", "-n", "true", "-c", "/", "--", "/usr/bin/env", "--", "PATH=/usr/bin:/bin", "sleep", "30"], ["/usr/bin/tmux", "-S", "/tmp/tmux-1000/default", "if-shell", "-F", "-t", "%NEW", "--", "#{&&:#{==:#{@termctl_pane},},#{==:#{window_id},@NEW}}", "'set' '-p' '-t' '%NEW' '--' '@termctl_v' '1' ; 'set' '-p' '-t' '%NEW' '--' '@termctl_window' '@NEW' ; 'set' '-p' '-t' '%NEW' '--' '@termctl_id' 'tc-abcdefgh' ; 'set' '-p' '-t' '%NEW' '--' '@termctl_name' 'true' ; 'set' '-p' '-t' '%NEW' '--' '@termctl_marker' '' ; 'set' '-p' '-t' '%NEW' '--' '@termctl_marker_text' '' ; 'set' '-p' '-t' '%NEW' '--' '@termctl_labels' 'kind=review' ; 'set' '-p' '-t' '%NEW' '--' '@termctl_placement' 'default' ; 'set' '-p' '-t' '%NEW' '--' '@termctl_keep' 'never' ; 'set' '-p' '-t' '%NEW' '--' '@termctl_created' '2026-01-01T00:00:00.000Z' ; 'set' '-p' '-t' '%NEW' '--' '@termctl_pid' '' ; 'set' '-p' '-t' '%NEW' '--' '@termctl_pid_start' '' ; 'set' '-p' '-t' '%NEW' '--' '@termctl_pane' '%NEW' ; 'set' '-w' '-t' '%NEW' '--' 'automatic-rename' 'off' ; 'set' '-w' '-t' '%NEW' '--' 'allow-rename' 'off' ; 'set' '-p' '-t' '%NEW' '--' 'remain-on-exit' 'off' ; 'respawn-pane' '-k' '-t' '%NEW' '-c' '/' '-e' 'TOKEN' '--' '/usr/bin/env' '--' 'true' ; 'display' '-p' '-t' '%NEW' '--' '#{pane_pid} #{pane_dead} #{pid}' ; 'display' '-p' '-t' '%NEW' '--' 'termctl-tagged'", "'display' '-p' '--' 'termctl-nomatch'"]]}
